{
  "schema_version":"anpr-processing-notice-v1","contact":"erncnkr@gmail.com","acknowledgement_required":true,"legal_basis_claim":"user_acknowledgement_not_sole_legal_basis",
  "notices":{
    "en":{"purpose":"The image is processed to detect and read a licence plate.","authorization":"You must be authorized to submit and process this image.","accuracy":"Detection and recognition results can be incorrect or incomplete.","human_review":"A person must review every result before relying on it.","retention":"Images and results are not intentionally retained. For the five-per-day IP limit (Istanbul time), we store a pseudonymous counter, not your raw IP or image. Shared networks share the quota. Old counters are deleted after the next valid request.","training":"Submitted images are not used for model training or dataset construction.","prohibited_uses":"Do not use this service for unlawful tracking, mass surveillance, automated enforcement, identity inference, or decisions without human review.","acknowledgement_label":"I have read this notice and I am authorized to submit the image."},
    "tr":{"purpose":"Görüntü, araç plakasını tespit etmek ve okumak amacıyla işlenir.","authorization":"Bu görüntüyü göndermek ve işlemek için yetkili olmalısınız.","accuracy":"Tespit ve tanıma sonuçları yanlış veya eksik olabilir.","human_review":"Her sonuç kullanılmadan önce bir kişi tarafından incelenmelidir.","retention":"Görüntüler ve sonuçlar bilerek saklanmaz. İstanbul saatine göre IP başına günlük beş deneme için ham IP veya görüntü değil, takma adlı sayaç tutulur. Ortak ağlar kotayı paylaşır. Eski sayaçlar sonraki geçerli istekle silinir.","training":"Gönderilen görüntüler model eğitimi veya veri kümesi oluşturmak için kullanılmaz.","prohibited_uses":"Bu hizmeti hukuka aykırı takip, kitlesel gözetim, otomatik yaptırım, kimlik çıkarımı veya insan incelemesi olmadan karar vermek için kullanmayın.","acknowledgement_label":"Bu bildirimi okudum ve görüntüyü göndermeye yetkiliyim."}
  }
}
